movie,viewer_score_classification,vote_average,vote_classification,vote_count,movie_cast,summary,plot_summary
The Dark Knight,High,8.5,High,10.41711923563258,"['Gary Oldman', '陳冠希', 'Cillian Murphy', 'Morgan Freeman', 'Michael Caine']","Batman raises the stakes in his war on crime. With the help of Lt. Jim Gordon and District Attorney Harvey Dent, Batman sets out to dismantle the remaining criminal organizations that plague the streets. The partnership proves to be effective, but they soon find themselves prey to a reign of chaos unleashed by a rising criminal mastermind known to the terrified citizens of Gotham as the Joker.",N/A
The Lord of the Rings: The Return of the King,High,8.5,High,10.114720452824503,"['Cate Blanchett', 'Viggo Mortensen', 'Elijah Wood', 'Sean Bean', 'Ian McKellen']","As armies mass for a final battle that will decide the fate of the world--and powerful, ancient forces of Light and Dark compete to determine the outcome--one member of the Fellowship of the Ring is revealed as the noble heir to the throne of the Kings of Men. Yet, the sole hope for triumph over evil lies with a brave hobbit, Frodo, who, accompanied by his loyal friend Sam and the hideous, wretched Gollum, ventures deep into the very dark heart of Mordor on his seemingly impossible quest to destroy the Ring of Power.​",N/A
Seven Samurai,High,8.5,High,8.241966560231802,"['三船敏郎', '小杉義男', '仲代達矢', '津島恵子', '藤原釜足']","A samurai answers a village's request for protection after he falls on hard times. The town needs protection from bandits, so the samurai gathers six others to help him teach the people how to defend themselves, and the villagers provide the soldiers with food.",N/A
Inception,High,8.4,High,10.52023953184236,"['Leonardo DiCaprio', 'Tom Hardy', 'Cillian Murphy', 'Tom Berenger', 'Joseph Gordon-Levitt']","Cobb, a skilled thief who commits corporate espionage by infiltrating the subconscious of his targets is offered a chance to regain his old life as payment for a task considered to be impossible: ""inception"", the implantation of another person's idea into a target's subconscious.",N/A
The Lord of the Rings: The Fellowship of the Ring,High,8.4,High,10.15085531407452,"['Cate Blanchett', 'Viggo Mortensen', 'Elijah Wood', 'Sean Bean', 'Ian McKellen']","Young hobbit Frodo Baggins, after inheriting a mysterious ring from his uncle Bilbo, must leave his home in order to keep it from falling into the hands of its evil creator. Along the way, a fellowship is formed to protect the ringbearer and make sure that the ring arrives at its final destination: Mt. Doom, the only place where it can be destroyed.",N/A
